sujet,date,statut
Comment les peintres flamands du XVe siècle inventent-ils le paysage de fond dans les retables ?,2025-10-15T06:04:18.066467,succès
Pourquoi les cirques glaciaires alpins inspirent-ils les symbolistes suisses ?,2025-10-20T08:51:40.710190,succès
Quelle est la différence entre la représentation des montagnes chez Hokusai et Hiroshige ?,2025-10-27T08:54:04.854773,succès
Comment les peintres romantiques anglais documentent-ils l'industrialisation des paysages miniers ?,2025-11-03T09:01:42.482600,succès
Pourquoi les lagunes vénitiennes deviennent-elles un laboratoire pour les impressionnistes ?,2025-11-10T08:55:04.746457,succès
Quelle méthode permet de peindre les reflets complexes sur une surface d'eau agitée ?,2025-11-17T08:40:59.807490,succès
Comment les artistes maoris intègrent-ils les légendes volcaniques dans leurs représentations paysagères ?,2025-11-24T08:40:36.869072,succès
Pourquoi les badlands américains attirent-ils les peintres de la couleur pure au XXe siècle ?,2025-12-01T08:42:49.767227,succès
Quelle est l'influence des théories de John Ruskin sur l'observation géologique en peinture ?,2025-12-08T08:42:50.543411,succès
Pourquoi les estuaires boueux fascinent-ils les paysagistes hollandais du Siècle d'Or ?,2025-12-15T08:44:21.007921,succès
Quelle technique permet de différencier visuellement les types de sols dans un paysage agricole ?,2025-12-22T08:42:20.340714,succès
Comment David Friedrich peint-il les affleurements rocheux comme des révélations métaphysiques ?,2025-12-29T08:43:38.463723,succès
Pourquoi les peintres préraphaélites exigent-ils une exactitude botanique et géologique ?,2026-01-05T08:47:15.322899,succès
Quelle est la relation entre peinture de paysage et exploration scientifique en Arctique ?,2026-01-12T08:45:36.417177,succès
Comment Albert Bierstadt exagère-t-il les dimensions des formations rocheuses pour l'effet dramatique ?,2026-01-19T08:46:39.243370,succès
Quelle méthode les peintres baroques utilisaient-ils pour créer des paysages composites imaginaires ?,2026-01-26T08:47:15.068602,succès
Comment les artistes contemporains représentent-ils l'extraction minière dans leurs paysages critiques ?,2026-02-02T08:58:28.637127,succès
